{
  "record_schema_version": "1",
  "policy_id": "local-default",
  "version": "1.0.0",
  "content_hash": "b12a3926a732b08e18c0b2f2b2709d42c22216bb6009e539e3feb1e4d4f1a2e6",
  "status": "active",
  "reviewer": "local-owner",
  "reviewed_at": "2026-07-29T00:00:00Z",
  "activated_at": "2026-07-29T00:00:00Z"
}
